{"contract_name":"operational_status","contract_version":1,"audit_event":{"event_id":"audit_alpha","event_type":"proposal_approved","stage":"finalize","subject_id":"proposal_alpha","outcome":"accepted","detail_code":"revision_advanced"},"idempotency_receipt":{"receipt_id":"receipt_alpha","idempotency_key":"idem_alpha","payload_digest":"aaaaaaaaaaaaaaaaaaaaaaaaaaaaaaaaaaaaaaaaaaaaaaaaaaaaaaaaaaaaaaaa","outcome":"accepted"},"reconciliation":{"intent_id":"intent_alpha","classification":"finalized","matching_intent_count":1},"backup_manifest":{"backup_id":"backup_alpha","application_version":"1.0.0","schema_version":1,"snapshot_inventory_digest":"bbbbbbbbbbbbbbbbbbbbbbbbbbbbbbbbbbbbbbbbbbbbbbbbbbbbbbbbbbbbbbbb","database_archive_digest":"cccccccccccccccccccccccccccccccccccccccccccccccccccccccccccccccc","unsynchronized_data_acknowledged":true,"secrets_included":false},"health":{"liveness":"live","readiness":"ready","maintenance":false,"provider_state":"degraded","capture_available":true}}
